{"id":"ART-CASE-0015","version":"0.1","title":"Permit decision where legal responsibility remains external","domain":"public-sector","case_type":"synthetic-adversarial","status":"OPEN","operational_setting":"An automated system evaluates permit criteria and produces a decision record, while legal responsibility is assigned by statute rather than system provenance.","actors":["agency","decision system","applicant"],"trust_boundary":"Government decision affects an external rights-bearing party.","initial_state":"Permit application pending.","intended_transition":"Permit becomes approved or denied.","constraints":["Statutory criteria","Appeal rights"],"candidate_under_attack":"Responsibility","attack":{"method":"deletion","removed_or_replaced":"Responsibility as protocol primitive","allowed_substitutes":["external law","organizational policy"],"procedure":"Keep responsibility entirely outside the technical event model and test whether the operational system remains complete while legal attribution is determined separately."},"success_criteria_for_attack":"If the technical system operates correctly and law supplies responsibility, Responsibility should remain an external institutional function rather than a core protocol primitive.","evidence_requirements":["decision trace","statutory responsibility rule","appeal process"],"observations":[],"information_loss":[],"verdict":{"result":"INDETERMINATE","rationale":"Designed to limit protocol-level responsibility claims."},"sources":[],"created_at":"2026-08-15","last_evaluated_at":null}
