{"id":"ART-CASE-0007","version":"0.1","title":"Marketplace transaction settles on execution receipt only","domain":"commerce","case_type":"synthetic-adversarial","status":"OPEN","operational_setting":"A digital marketplace automatically pays a service provider once an execution receipt says the requested action completed.","actors":["buyer","service provider","marketplace"],"trust_boundary":"Buyer and provider do not fully trust each other; marketplace mediates settlement.","initial_state":"Service requested; funds held.","intended_transition":"Requested service outcome is accepted and funds released.","constraints":["Deadline","Scope","Payment cap"],"candidate_under_attack":"Verification","attack":{"method":"deletion","removed_or_replaced":"Independent outcome verification","allowed_substitutes":["provider execution receipt"],"procedure":"Settle solely from provider-issued execution evidence and test whether outcome-sensitive disputes can be resolved without independent result verification."},"success_criteria_for_attack":"If execution receipts remain sufficient even when the result matters independently from the action, separate Verification is weakened.","evidence_requirements":["execution receipt","buyer acceptance/dispute data","settlement trace"],"observations":[],"information_loss":[],"verdict":{"result":"INDETERMINATE","rationale":"Targets Action-versus-Outcome and Verification necessity."},"sources":[],"created_at":"2026-08-15","last_evaluated_at":null}
