{"id":"ART-CASE-0001","version":"0.1","title":"Agent executes a fully deterministic thermostat policy","domain":"agents","case_type":"synthetic-adversarial","status":"OPEN","operational_setting":"A building-control agent must shut down cooling when a fixed sensor threshold and pre-approved policy condition are met.","actors":["building owner","control agent"],"trust_boundary":"The agent acts on infrastructure owned by another principal.","initial_state":"Cooling system active; temperature above fixed threshold.","intended_transition":"Cooling system transitions to the policy-defined safe state.","constraints":["Only pre-approved actuators may be changed","Policy is deterministic"],"candidate_under_attack":"Judgment","attack":{"method":"deletion","removed_or_replaced":"Explicit Judgment event","allowed_substitutes":["fixed policy","authorization record","execution log"],"procedure":"Remove any explicit judgment/decision commitment record and test whether the system remains operationally complete and auditable for the stated deterministic action."},"success_criteria_for_attack":"If policy plus authorization plus execution evidence is sufficient with no material missing information, explicit Judgment is not necessary in this scope.","evidence_requirements":["policy definition","authorization trace","execution trace"],"observations":[],"information_loss":[],"verdict":{"result":"INDETERMINATE","rationale":"Initial adversarial probe; requires implementation trace."},"sources":[],"created_at":"2026-08-15","last_evaluated_at":null}
