{"id":"ART-CASE-0003","version":"0.1","title":"Enterprise deploy pipeline without explicit target object","domain":"enterprise","case_type":"synthetic-adversarial","status":"OPEN","operational_setting":"A deployment service promotes a software build from staging to production using ordinary CI/CD configuration and tests.","actors":["software team","deployment service"],"trust_boundary":"The deployment service changes production state on behalf of the software team.","initial_state":"Version N running in production.","intended_transition":"Version N+1 is accepted as production-ready and deployed.","constraints":["Tests pass","Change window valid","Rollback available"],"candidate_under_attack":"Target","attack":{"method":"deletion","removed_or_replaced":"Portable Target object","allowed_substitutes":["pipeline configuration","test suite","deployment manifest"],"procedure":"Operate the full workflow without an explicit target-state object and measure whether completion semantics remain unambiguous across independent tools."},"success_criteria_for_attack":"If pipeline artifacts fully and portably define acceptable completion without reconstructing target semantics, the claim for a distinct target object is weakened.","evidence_requirements":["pipeline config","deployment manifest","acceptance test definitions"],"observations":[],"information_loss":[],"verdict":{"result":"INDETERMINATE","rationale":"Tests semantic portability, not whether deployment itself can work."},"sources":[],"created_at":"2026-08-15","last_evaluated_at":null}
