{"id":"ART-CASE-0006","version":"0.1","title":"Loan approval reconstructed from policy and signed transaction only","domain":"finance","case_type":"synthetic-adversarial","status":"OPEN","operational_setting":"An automated lender evaluates an application, applies a fixed policy, and issues a loan contract if conditions are satisfied.","actors":["lender","decision system","borrower"],"trust_boundary":"Automated decision creates a legally and economically consequential external obligation.","initial_state":"Application pending; no loan obligation.","intended_transition":"Loan is approved and contract becomes effective.","constraints":["Credit policy","Exposure limit","Required disclosures"],"candidate_under_attack":"Judgment","attack":{"method":"hidden-reconstruction","removed_or_replaced":"Explicit approval judgment","allowed_substitutes":["policy result","signed contract","audit log"],"procedure":"Remove a distinct approval event and determine whether the policy output plus resulting contract contains every fact required to explain who or what committed to the approval."},"success_criteria_for_attack":"If no independent commitment fact is needed, Judgment is reducible for this class of automated decision.","evidence_requirements":["policy evaluation trace","contract signature","audit record"],"observations":[],"information_loss":[],"verdict":{"result":"INDETERMINATE","rationale":"Tests Judgment versus policy-result reducibility."},"sources":[],"created_at":"2026-08-15","last_evaluated_at":null}
