{"id":"ART-CASE-0013","version":"0.1","title":"Warehouse robot with unrestricted high-level goal","domain":"robotics","case_type":"synthetic-adversarial","status":"OPEN","operational_setting":"A robot is told to maximize throughput with no explicit operational constraints beyond the goal.","actors":["warehouse operator","robot"],"trust_boundary":"Robot controls physical equipment and can affect workers and inventory.","initial_state":"Warehouse operating normally.","intended_transition":"Higher throughput is achieved.","constraints":[],"candidate_under_attack":"Constraint","attack":{"method":"deletion","removed_or_replaced":"Explicit constraints/boundaries","allowed_substitutes":["implicit common sense","safety defaults"],"procedure":"Remove explicit safety, budget and access constraints and determine whether the system can safely optimize the target without reconstructing boundaries elsewhere."},"success_criteria_for_attack":"If a target alone is sufficient in the defined physical environment, Constraint is weakened; if safety/default rules reappear, the structure survives under another name.","evidence_requirements":["robot policy","safety layer","incident simulation"],"observations":[],"information_loss":[],"verdict":{"result":"INDETERMINATE","rationale":"Tests Target versus bounded target semantics."},"sources":[],"created_at":"2026-08-15","last_evaluated_at":null}
