{"id":"ART-CASE-0005","version":"0.1","title":"Trading bot operates under a capability token only","domain":"finance","case_type":"synthetic-adversarial","status":"OPEN","operational_setting":"A trading bot receives a capability allowing trades within asset, amount and time limits and executes deterministic signals.","actors":["fund","trading bot","broker"],"trust_boundary":"The bot can move capital through an external broker.","initial_state":"Capital held; no current order.","intended_transition":"Permitted trade is executed within risk bounds.","constraints":["Asset allowlist","Position limit","Expiry"],"candidate_under_attack":"BoundedAuthority","attack":{"method":"substitution","removed_or_replaced":"Separate ART authority model","allowed_substitutes":["capability token"],"procedure":"Use a standard capability representation as the sole authority mechanism and test whether ART adds any independent information beyond the capability semantics."},"success_criteria_for_attack":"If capability semantics fully encode scope, validity, delegation and revocation needs, a separate ART authority construct is redundant in this scope.","evidence_requirements":["capability definition","broker enforcement trace","delegation/revocation behavior"],"observations":[],"information_loss":[],"verdict":{"result":"INDETERMINATE","rationale":"Tests whether ART should defer entirely to capability systems for authority."},"sources":[],"created_at":"2026-08-15","last_evaluated_at":null}
