{"id":"ART-CASE-0010","version":"0.1","title":"Consent delegated to a proxy with revocation","domain":"healthcare","case_type":"synthetic-adversarial","status":"OPEN","operational_setting":"A patient authorizes a healthcare proxy to make a bounded class of decisions and later revokes the proxy authority.","actors":["patient","proxy","care organization"],"trust_boundary":"Proxy acts with authority derived from another person and across institutional systems.","initial_state":"Patient controls the relevant decision authority.","intended_transition":"Proxy authority becomes active, may be exercised, and later becomes invalid.","constraints":["Scope-limited","Time/context-limited","Revocable"],"candidate_under_attack":"Delegation","attack":{"method":"substitution","removed_or_replaced":"Delegation provenance","allowed_substitutes":["identity record","current ACL","signed consent form"],"procedure":"Attempt to operate safely using only the proxy's current permission and identity without preserving how authority was derived from the patient."},"success_criteria_for_attack":"If provenance of authority source is unnecessary across transitions and disputes, Delegation as a distinct structure is weakened.","evidence_requirements":["consent artifact","ACL state","revocation trace","dispute scenario"],"observations":[],"information_loss":[],"verdict":{"result":"INDETERMINATE","rationale":"Tests source-of-authority provenance."},"sources":[],"created_at":"2026-08-15","last_evaluated_at":null}
