{"id":"ART-CASE-0018","version":"0.1","title":"Event-sourced system reconstructs state without explicit outcome object","domain":"software","case_type":"synthetic-adversarial","status":"OPEN","operational_setting":"A distributed application records events and derives current state by replay, without storing a distinct outcome object for every transition.","actors":["application services","auditor"],"trust_boundary":"Multiple services contribute events consumed by an independent auditor.","initial_state":"State derived from event history.","intended_transition":"A business condition becomes true after a sequence of events.","constraints":["Events immutable","Replay deterministic"],"candidate_under_attack":"Action","attack":{"method":"alternative-grammar","removed_or_replaced":"ART-style action/outcome decomposition","allowed_substitutes":["event-sourcing model","state derivation"],"procedure":"Represent the workflow only as immutable domain events and derived state, then test whether ART introduces any additional irreducible object beyond established event/state semantics."},"success_criteria_for_attack":"If event sourcing preserves all relevant control and verification information, parts of ART may be descriptive relabeling rather than new structure.","evidence_requirements":["event schema","state reducer","audit queries"],"observations":[],"information_loss":[],"verdict":{"result":"INDETERMINATE","rationale":"Direct prior-art pressure test against state/event traditions."},"sources":[],"created_at":"2026-08-15","last_evaluated_at":null}
