{"id":"ART-CASE-0016","version":"0.1","title":"Emergency authority granted verbally then acted upon","domain":"public-sector","case_type":"synthetic-adversarial","status":"OPEN","operational_setting":"During an emergency, an authorized official verbally grants temporary authority that is acted upon before a formal digital record exists.","actors":["official","emergency operator","agency"],"trust_boundary":"Operator exercises exceptional public authority based on another actor's grant.","initial_state":"Operator lacks ordinary authority for the exceptional action.","intended_transition":"Emergency action becomes temporarily authorized and executed.","constraints":["Emergency scope","Short duration","Post-hoc review"],"candidate_under_attack":"Delegation","attack":{"method":"hidden-reconstruction","removed_or_replaced":"Machine-readable delegation object at action time","allowed_substitutes":["verbal authorization","later attestation"],"procedure":"Test whether the system can remain accountable if delegation is initially off-system and only reconstructed after execution."},"success_criteria_for_attack":"If portable pre-action delegation provenance is unnecessary for safe/legitimate operation in emergency conditions, universality claims must narrow.","evidence_requirements":["authority testimony","later record","review outcome"],"observations":[],"information_loss":[],"verdict":{"result":"INDETERMINATE","rationale":"Tests delayed formalization and emergency exception cases."},"sources":[],"created_at":"2026-08-15","last_evaluated_at":null}
