{"id":"ART-CASE-0009","version":"0.1","title":"Clinical workflow where outcome cannot be deterministically verified","domain":"healthcare","case_type":"synthetic-adversarial","status":"OPEN","operational_setting":"A care intervention seeks to improve a patient's condition, but outcome attribution is noisy, delayed, and affected by uncontrolled factors.","actors":["patient","care organization","clinician","payer"],"trust_boundary":"Multiple institutions rely on different evidence and standards of proof.","initial_state":"Patient has documented condition.","intended_transition":"Meaningful clinical improvement occurs.","constraints":["Safety","Consent","Time window"],"candidate_under_attack":"Verification","attack":{"method":"cross-domain","removed_or_replaced":"Deterministic verification assumption","allowed_substitutes":["probabilistic assessment","clinical judgment","multi-source evidence"],"procedure":"Attempt to define a portable binary verification rule and record where uncertainty forces domain-specific judgment or an INDETERMINATE state."},"success_criteria_for_attack":"If high-value transitions cannot be verified cheaply or independently, broad commercialization claims for verified outcomes must narrow.","evidence_requirements":["clinical measurements","confounder analysis","verification cost estimate"],"observations":[],"information_loss":[],"verdict":{"result":"INDETERMINATE","rationale":"Tests oracle/verification economics in a difficult domain."},"sources":[],"created_at":"2026-08-15","last_evaluated_at":null}
