{"id":"ART-CASE-0002","version":"0.1","title":"Autonomous purchasing agent chooses among equivalent suppliers","domain":"agents","case_type":"synthetic-adversarial","status":"OPEN","operational_setting":"A purchasing agent has a bounded budget and selects one supplier among multiple compliant offers with materially different risk profiles.","actors":["principal company","purchasing agent","suppliers"],"trust_boundary":"The agent spends organizational funds with external counterparties.","initial_state":"Approved purchase need with multiple eligible offers.","intended_transition":"A valid purchase commitment is created with one supplier.","constraints":["Budget cap","Approved supplier class","Delivery deadline"],"candidate_under_attack":"Judgment","attack":{"method":"substitution","removed_or_replaced":"Judgment commitment","allowed_substitutes":["policy score","ranking log","action log"],"procedure":"Attempt to explain and audit the consequential supplier selection using only scores, authorization and execution data without a distinct commitment/selection record."},"success_criteria_for_attack":"If the selected future and accountable commitment are fully recoverable without a distinct Judgment-like record, the Judgment separation claim is weakened.","evidence_requirements":["candidate offers","ranking outputs","authorization","purchase action"],"observations":[],"information_loss":[],"verdict":{"result":"INDETERMINATE","rationale":"Requires comparison between policy logs and explicit commitment records."},"sources":[],"created_at":"2026-08-15","last_evaluated_at":null}
