{"id":"ART-CASE-0004","version":"0.1","title":"Approval expires without a first-class termination event","domain":"enterprise","case_type":"synthetic-adversarial","status":"OPEN","operational_setting":"A manager approves a transaction for 24 hours; the permission automatically expires without an explicit revocation event.","actors":["manager","employee","enterprise system"],"trust_boundary":"Employee acts under manager-granted authority.","initial_state":"No active transaction authority.","intended_transition":"Temporary authority is active only within the permitted window.","constraints":["24-hour validity","Single transaction"],"candidate_under_attack":"Termination","attack":{"method":"substitution","removed_or_replaced":"First-class Termination event","allowed_substitutes":["expires_at field","state invalidation"],"procedure":"Represent lifecycle closure solely through validity metadata and test whether any required cross-system information is lost."},"success_criteria_for_attack":"If expiry metadata is sufficient across systems, the claim that Termination must be a first-class event is weakened while termination semantics may survive.","evidence_requirements":["authorization object","expiry behavior","cross-system validation trace"],"observations":[],"information_loss":[],"verdict":{"result":"INDETERMINATE","rationale":"Designed specifically to attack event-form necessity."},"sources":[],"created_at":"2026-08-15","last_evaluated_at":null}
