{"id":"ART-CASE-0012","version":"0.1","title":"Multi-carrier shipment without shared temporal ordering","domain":"logistics","case_type":"synthetic-adversarial","status":"OPEN","operational_setting":"A shipment passes through three carriers that record handoffs using independent clocks and local identifiers.","actors":["carrier A","carrier B","carrier C","shipper"],"trust_boundary":"Independent organizations must reconstruct custody and authority across systems.","initial_state":"Carrier A has custody.","intended_transition":"Custody transfers through B and C to final delivery.","constraints":["No overlapping custody claims","Handoff authorization valid"],"candidate_under_attack":"TemporalOrdering","attack":{"method":"deletion","removed_or_replaced":"Portable ordering relation","allowed_substitutes":["local timestamps","eventual reconciliation"],"procedure":"Remove a common ordering mechanism and test whether custody, delegation and termination claims remain determinable under clock skew and concurrent events."},"success_criteria_for_attack":"If local timestamps and reconciliation suffice without ambiguity, explicit portable temporal ordering is weakened.","evidence_requirements":["handoff events","clock offsets","conflict examples"],"observations":[],"information_loss":[],"verdict":{"result":"INDETERMINATE","rationale":"Tests whether partial ordering is a non-removable substrate."},"sources":[],"created_at":"2026-08-15","last_evaluated_at":null}
