{"id":"ART-CASE-0008","version":"0.1","title":"Outcome contract with terminal-state-only semantics","domain":"commerce","case_type":"synthetic-adversarial","status":"OPEN","operational_setting":"A buyer pays only if a final measurable KPI reaches a threshold, without caring about the initial value or path taken.","actors":["buyer","provider","verifier"],"trust_boundary":"Provider is paid based on independently observed result.","initial_state":"Initial KPI may be unknown or deliberately ignored.","intended_transition":"Final KPI is at or above the contracted threshold.","constraints":["Measurement source fixed","Deadline fixed"],"candidate_under_attack":"Baseline","attack":{"method":"deletion","removed_or_replaced":"Explicit Baseline","allowed_substitutes":["terminal measurement only"],"procedure":"Define and settle the contract using only a target threshold and final observation, then test whether any economically relevant information is missing."},"success_criteria_for_attack":"If the contract remains complete, Baseline is not a universal requirement and should remain outside the ART kernel.","evidence_requirements":["contract","final measurement","settlement rule"],"observations":[],"information_loss":[],"verdict":{"result":"INDETERMINATE","rationale":"Designed to narrow Baseline claims."},"sources":[],"created_at":"2026-08-15","last_evaluated_at":null}
