{"id":"ART-CASE-0017","version":"0.1","title":"Self-healing service acts without human-selected target per incident","domain":"software","case_type":"synthetic-adversarial","status":"OPEN","operational_setting":"A service automatically restarts or rolls back components when a fixed health invariant is violated.","actors":["service owner","self-healing controller"],"trust_boundary":"Controller changes production state under pre-authorized policy.","initial_state":"Health invariant violated.","intended_transition":"System returns to a healthy invariant-satisfying state.","constraints":["Only approved recovery actions","SLO preserved"],"candidate_under_attack":"Judgment","attack":{"method":"deletion","removed_or_replaced":"Incident-specific Judgment","allowed_substitutes":["precommitted invariant","policy","action trace"],"procedure":"Run recovery without creating a new judgment record for each incident and determine whether anything material is missing for accountability or interoperability."},"success_criteria_for_attack":"If precommitted target and policy fully subsume incident-specific Judgment, Judgment is conditional rather than universal.","evidence_requirements":["policy","health state","recovery trace"],"observations":[],"information_loss":[],"verdict":{"result":"INDETERMINATE","rationale":"Tests precommitment as a substitute for repeated judgments."},"sources":[],"created_at":"2026-08-15","last_evaluated_at":null}
