{"id":"ART-CASE-0020","version":"0.1","title":"Milestone payment handled entirely by existing contract and payment rails","domain":"supply-chain","case_type":"synthetic-adversarial","status":"OPEN","operational_setting":"A supplier is paid after an independently verified delivery milestone using an ordinary contract and existing payment infrastructure.","actors":["buyer","supplier","verifier","payment provider"],"trust_boundary":"Independent parties coordinate result acceptance and payment.","initial_state":"Milestone incomplete; payment not due.","intended_transition":"Milestone accepted and payment obligation fulfilled.","constraints":["Verification policy fixed","Payment terms fixed"],"candidate_under_attack":"Settlement","attack":{"method":"substitution","removed_or_replaced":"ART-specific settlement layer","allowed_substitutes":["ordinary contract","existing payment rails"],"procedure":"Use ART/TSTO only for target/verification semantics while leaving settlement entirely to existing contract and payment infrastructure."},"success_criteria_for_attack":"If no ART-specific settlement abstraction is needed, Settlement should remain an external integration point rather than a core ART layer.","evidence_requirements":["milestone definition","verification result","payment trace"],"observations":[],"information_loss":[],"verdict":{"result":"INDETERMINATE","rationale":"Tests complementarity with existing financial infrastructure."},"sources":[],"created_at":"2026-08-15","last_evaluated_at":null}
