{"id":"ART-CASE-0011","version":"0.1","title":"Delivery completion based on carrier scan only","domain":"logistics","case_type":"synthetic-adversarial","status":"OPEN","operational_setting":"A carrier marks a shipment delivered when its own device records a delivery scan, while recipient acceptance is not independently captured.","actors":["shipper","carrier","recipient"],"trust_boundary":"Carrier evidence is used by parties with potentially conflicting incentives.","initial_state":"Shipment in transit.","intended_transition":"Shipment accepted as delivered to the intended recipient/location.","constraints":["Correct location","Deadline","Package integrity"],"candidate_under_attack":"Evidence","attack":{"method":"substitution","removed_or_replaced":"Independent evidence set","allowed_substitutes":["carrier scan"],"procedure":"Use the carrier's self-issued scan as the only evidence and test whether the claimed transition can be robustly distinguished from action completion or false delivery."},"success_criteria_for_attack":"If self-issued evidence is enough under the actual trust model, broader independent-evidence claims weaken; otherwise Evidence/Verification survive.","evidence_requirements":["scan semantics","recipient disputes","location evidence"],"observations":[],"information_loss":[],"verdict":{"result":"INDETERMINATE","rationale":"Tests evidence source independence."},"sources":[],"created_at":"2026-08-15","last_evaluated_at":null}
