{"id":"ART-CASE-0014","version":"0.1","title":"Robot task authorized by shared group credential","domain":"robotics","case_type":"synthetic-adversarial","status":"OPEN","operational_setting":"Multiple robots share one group credential and execute maintenance actions with no stable per-robot identity binding.","actors":["facility operator","robot fleet"],"trust_boundary":"Robots perform physical maintenance on behalf of the facility operator.","initial_state":"Maintenance task pending.","intended_transition":"Specified maintenance action is completed.","constraints":["Authorized equipment only"],"candidate_under_attack":"ActorBinding","attack":{"method":"deletion","removed_or_replaced":"Stable actor binding","allowed_substitutes":["group credential","anonymous capability"],"procedure":"Operate and audit the workflow using only a group principal and test whether any necessary control, dispute, attribution, or termination function requires a stable actor binding."},"success_criteria_for_attack":"If group-level identity is sufficient for all required functions, per-actor binding is not universally required.","evidence_requirements":["credential model","execution logs","incident handling"],"observations":[],"information_loss":[],"verdict":{"result":"INDETERMINATE","rationale":"Tests scope of Actor Binding inevitability."},"sources":[],"created_at":"2026-08-15","last_evaluated_at":null}
