{"id":"ART-CASE-0019","version":"0.1","title":"Supplier compliance attestation without causal attribution","domain":"supply-chain","case_type":"synthetic-adversarial","status":"OPEN","operational_setting":"A buyer accepts a supplier only if required compliance evidence is verified; the buyer does not need to know what caused the supplier to become compliant.","actors":["buyer","supplier","verifier"],"trust_boundary":"Buyer relies on evidence from supplier and independent verifier.","initial_state":"Supplier compliance status not accepted.","intended_transition":"Supplier becomes accepted as meeting specified requirements.","constraints":["Evidence current","Verifier qualified"],"candidate_under_attack":"CausalAttribution","attack":{"method":"deletion","removed_or_replaced":"Causal attribution","allowed_substitutes":["state evidence","verification result"],"procedure":"Complete onboarding and settlement without representing who or what caused compliance, and test whether any operational requirement fails."},"success_criteria_for_attack":"If the process remains complete, causal attribution is downstream/conditional rather than part of the operational kernel.","evidence_requirements":["requirements","evidence","verification result","onboarding decision"],"observations":[],"information_loss":[],"verdict":{"result":"INDETERMINATE","rationale":"Tests whether attribution can be safely excluded from the core."},"sources":[],"created_at":"2026-08-15","last_evaluated_at":null}
